<?xml version="1.0" encoding="UTF-8" ?>

<!--公司员工数据-->
<!--第一项引用默认的命名空间,后两项几乎是写死的-->
<hr xmlns="http://ww.imooc.com/xml-schema"
    xmlns:xsi="http://www.w3.org/2001/XMLSchema-instance"
    xsi:schemaLocation="http://ww.imooc.com/xml-schema hr.xsd">
    <employee eno="2025020125">
        <name>Zenos</name>
        <age>22</age>
        <salary>4000</salary>
        <department>
            <dname>研发部</dname>
            <address>xx大厦-204</address>
        </department>
    </employee>
    <employee eno="2025020105">
        <name>Maria</name>
        <age>21</age>
        <salary>2000</salary>
        <department>
            <dname>会计部</dname>
            <address>xx大厦-105</address>
        </department>
    </employee>
</hr>